{
  "schema_version": "AGENT_BUILDER_SELF_KNOWLEDGE_SYSTEM_FULL_CONTRACT_V1",
  "generated_at_utc": "2026-05-28T15:44:58.6131166Z",
  "collection_status": "collected",
  "status_taxonomy": [
    "proven",
    "completed",
    "active",
    "candidate",
    "planned",
    "failed",
    "unknown",
    "missing_surface"
  ],
  "builder_identity": {
    "system": "Agent Builder",
    "repo_name": "e-factory-agent-builder",
    "repo_root": "",
    "active_line": "AGENT_BUILDER_SELF_DEVELOPMENT",
    "active_mode": "SELF_BUILD",
    "product_target": "Build a verified operating contour first, then build other agents from formal specs."
  },
  "repo_markers": [
    {
      "path": "CAPABILITY_ROADMAP.json",
      "area": "Repo Identity",
      "kind": "file",
      "status": "proven"
    },
    {
      "path": "GENESIS_STATE.json",
      "area": "Repo Identity",
      "kind": "file",
      "status": "proven"
    },
    {
      "path": "TASK_QUEUE.json",
      "area": "Repo Identity",
      "kind": "file",
      "status": "proven"
    },
    {
      "path": "packs/registry.json",
      "area": "Repo Identity",
      "kind": "file",
      "status": "proven"
    },
    {
      "path": "orchestrator/run.ps1",
      "area": "Repo Identity",
      "kind": "file",
      "status": "proven"
    }
  ],
  "current_state": {
    "source_path": "GENESIS_STATE.json",
    "current_capability": "agent_builder_self_knowledge_system_full_contract_v1",
    "completed_capabilities_count": 85,
    "self_build_ready": "True"
  },
  "queue_state": {
    "source_path": "TASK_QUEUE.json",
    "active_task_id": "NONE",
    "clean": true
  },
  "roadmap_summary": {
    "source_path": "CAPABILITY_ROADMAP.json",
    "phase_78": {
      "id": "agent_builder_self_knowledge_system_full_contract_v1",
      "phase": "PHASE_78",
      "gate": "AGENT_BUILDER_SELF_KNOWLEDGE_SYSTEM_FULL_CONTRACT_V1",
      "status": "completed",
      "raw_status": "COMPLETED",
      "source_path": "CAPABILITY_ROADMAP.json"
    },
    "counts": {
      "total": 87,
      "completed": 86,
      "active": 0,
      "candidate": 0,
      "planned": 0,
      "failed": 1,
      "proven_by_evidence_file": 71,
      "unknown": 0
    },
    "latest_active": [],
    "latest_completed": [
      {
        "id": "runbook_executor_agent_production_v1",
        "phase": "PHASE_73",
        "gate": "RUNBOOK_EXECUTOR_AGENT_PRODUCTION_V1",
        "status": "completed",
        "raw_status": "COMPLETED",
        "evidence_status": "proven",
        "evidence_paths": [
          "proofs/RUNBOOK_EXECUTOR_AGENT_PRODUCTION_V1.json",
          "reports/external_agent_production/RUNBOOK_EXECUTOR_AGENT_PRODUCTION_V1_REPORT.json"
        ],
        "source_path": "CAPABILITY_ROADMAP.json"
      },
      {
        "id": "runbook_executor_agent_github_action_launch_v1",
        "phase": null,
        "gate": null,
        "status": "completed",
        "raw_status": "COMPLETED",
        "evidence_status": "proven",
        "evidence_paths": [
          "proofs/RUNBOOK_EXECUTOR_AGENT_GITHUB_ACTION_LAUNCH_V1.json",
          "reports/external_agent_production/RUNBOOK_EXECUTOR_AGENT_GITHUB_ACTION_LAUNCH_V1_REPORT.json"
        ],
        "source_path": "CAPABILITY_ROADMAP.json"
      },
      {
        "id": "runbook_executor_agent_github_action_acceptance_v1",
        "phase": null,
        "gate": null,
        "status": "completed",
        "raw_status": "COMPLETED",
        "evidence_status": "proven",
        "evidence_paths": [
          "proofs/RUNBOOK_EXECUTOR_AGENT_GITHUB_ACTION_ACCEPTANCE_V1.json",
          "reports/external_agent_production/RUNBOOK_EXECUTOR_AGENT_GITHUB_ACTION_ACCEPTANCE_V1_REPORT.json"
        ],
        "source_path": "CAPABILITY_ROADMAP.json"
      },
      {
        "id": "agent_production_closed_loop_standard_v1",
        "phase": "PHASE_76",
        "gate": "AGENT_PRODUCTION_CLOSED_LOOP_STANDARD_V1",
        "status": "completed",
        "raw_status": "COMPLETED",
        "evidence_status": "proven",
        "evidence_paths": [
          "proofs/AGENT_PRODUCTION_CLOSED_LOOP_STANDARD_V1.json",
          "reports/external_agent_production/AGENT_PRODUCTION_CLOSED_LOOP_STANDARD_V1_REPORT.json"
        ],
        "source_path": "CAPABILITY_ROADMAP.json"
      },
      {
        "id": "evidence_packager_agent_closed_loop_trial_v1",
        "phase": "PHASE_77",
        "gate": "EVIDENCE_PACKAGER_AGENT_CLOSED_LOOP_TRIAL_V1",
        "status": "completed",
        "raw_status": "COMPLETED",
        "evidence_status": "proven",
        "evidence_paths": [
          "proofs/EVIDENCE_PACKAGER_AGENT_CLOSED_LOOP_TRIAL_V1.json",
          "reports/external_agent_production/EVIDENCE_PACKAGER_AGENT_CLOSED_LOOP_TRIAL_V1_REPORT.json"
        ],
        "source_path": "CAPABILITY_ROADMAP.json"
      }
    ]
  },
  "capability_manifest": {
    "schema_version": "AGENT_BUILDER_CAPABILITY_MANIFEST_V1",
    "generated_at_utc": "2026-05-28T15:44:58.6131166Z",
    "collection_status": "collected",
    "source_files": [
      "CAPABILITY_ROADMAP.json",
      "GENESIS_STATE.json",
      "proofs/",
      "reports/"
    ],
    "capabilities": [
      {
        "id": "runbook_executor_agent_github_action_acceptance_v1",
        "phase": null,
        "gate": null,
        "status": "completed",
        "raw_status": "COMPLETED",
        "evidence_status": "proven",
        "evidence_paths": [
          "proofs/RUNBOOK_EXECUTOR_AGENT_GITHUB_ACTION_ACCEPTANCE_V1.json",
          "reports/external_agent_production/RUNBOOK_EXECUTOR_AGENT_GITHUB_ACTION_ACCEPTANCE_V1_REPORT.json"
        ],
        "source_path": "CAPABILITY_ROADMAP.json"
      },
      {
        "id": "runbook_executor_agent_github_action_launch_v1",
        "phase": null,
        "gate": null,
        "status": "completed",
        "raw_status": "COMPLETED",
        "evidence_status": "proven",
        "evidence_paths": [
          "proofs/RUNBOOK_EXECUTOR_AGENT_GITHUB_ACTION_LAUNCH_V1.json",
          "reports/external_agent_production/RUNBOOK_EXECUTOR_AGENT_GITHUB_ACTION_LAUNCH_V1_REPORT.json"
        ],
        "source_path": "CAPABILITY_ROADMAP.json"
      },
      {
        "id": "generated_conveyor_failure_trial_family_v1_failure_pack_v1",
        "phase": "GENERATED_CONVEYOR_FAILURE_TRIAL_FAMILY_V1_PHASE_1",
        "gate": "GENERATED_CONVEYOR_FAILURE_TRIAL_FAMILY_V1_FAILURE_PACK_V1",
        "status": "failed",
        "raw_status": "FAILED",
        "evidence_status": "proven",
        "evidence_paths": [
          "proofs/GENERATED_CONVEYOR_FAILURE_TRIAL_FAMILY_V1_FAILURE_PACK_V1.json",
          "reports/generated_family_autonomous_conveyor/GENERATED_CONVEYOR_FAILURE_TRIAL_FAMILY_V1_FAILURE_PACK_V1_REPORT.json"
        ],
        "source_path": "CAPABILITY_ROADMAP.json"
      },
      {
        "id": "generated_conveyor_trial_family_v1_live_pack_v1",
        "phase": "GENERATED_CONVEYOR_TRIAL_FAMILY_V1_PHASE_1",
        "gate": "GENERATED_CONVEYOR_TRIAL_FAMILY_V1_LIVE_PACK_V1",
        "status": "completed",
        "raw_status": "COMPLETED",
        "evidence_status": "proven",
        "evidence_paths": [
          "proofs/GENERATED_CONVEYOR_TRIAL_FAMILY_V1_LIVE_PACK_V1.json",
          "reports/generated_family_autonomous_conveyor/GENERATED_CONVEYOR_TRIAL_FAMILY_V1_LIVE_PACK_V1_REPORT.json"
        ],
        "source_path": "CAPABILITY_ROADMAP.json"
      },
      {
        "id": "generated_monitoring_agent_v1_profile_materialization_v1",
        "phase": "GENERATED_MONITORING_AGENT_V1_PHASE_1",
        "gate": "GENERATED_MONITORING_AGENT_V1_PROFILE_MATERIALIZATION_V1_READY",
        "status": "completed",
        "raw_status": "COMPLETED",
        "evidence_status": "proven",
        "evidence_paths": [
          "proofs/GENERATED_MONITORING_AGENT_V1_PROFILE_MATERIALIZATION_V1.json"
        ],
        "source_path": "CAPABILITY_ROADMAP.json"
      },
      {
        "id": "generated_monitoring_agent_v1_closure_proof_v1",
        "phase": "GENERATED_MONITORING_AGENT_V1_PHASE_2",
        "gate": "GENERATED_MONITORING_AGENT_V1_CLOSURE_PROOF_V1",
        "status": "completed",
        "raw_status": "COMPLETED",
        "evidence_status": "proven",
        "evidence_paths": [
          "proofs/GENERATED_MONITORING_AGENT_V1_CLOSURE_PROOF_V1.json"
        ],
        "source_path": "CAPABILITY_ROADMAP.json"
      },
      {
        "id": "generated_monitoring_agent_v1_seed_consumption_proof_v1",
        "phase": "GENERATED_MONITORING_AGENT_V1_PHASE_3",
        "gate": "GENERATED_MONITORING_AGENT_V1_SEED_CONSUMPTION_PROOF_V1",
        "status": "completed",
        "raw_status": "COMPLETED",
        "evidence_status": "proven",
        "evidence_paths": [
          "proofs/GENERATED_MONITORING_AGENT_V1_SEED_CONSUMPTION_PROOF_V1.json"
        ],
        "source_path": "CAPABILITY_ROADMAP.json"
      },
      {
        "id": "generated_remediation_intake_agent_v1_profile_materialization_v1",
        "phase": "GENERATED_REMEDIATION_INTAKE_AGENT_V1_PHASE_1",
        "gate": "GENERATED_REMEDIATION_INTAKE_AGENT_V1_PROFILE_MATERIALIZATION_V1_READY",
        "status": "completed",
        "raw_status": "COMPLETED",
        "evidence_status": "proven",
        "evidence_paths": [
          "proofs/GENERATED_REMEDIATION_INTAKE_AGENT_V1_PROFILE_MATERIALIZATION_V1.json"
        ],
        "source_path": "CAPABILITY_ROADMAP.json"
      },
      {
        "id": "generated_remediation_intake_agent_v1_closure_proof_v1",
        "phase": "GENERATED_REMEDIATION_INTAKE_AGENT_V1_PHASE_2",
        "gate": "GENERATED_REMEDIATION_INTAKE_AGENT_V1_CLOSURE_PROOF_V1",
        "status": "completed",
        "raw_status": "COMPLETED",
        "evidence_status": "proven",
        "evidence_paths": [
          "proofs/GENERATED_REMEDIATION_INTAKE_AGENT_V1_CLOSURE_PROOF_V1.json"
        ],
        "source_path": "CAPABILITY_ROADMAP.json"
      },
      {
        "id": "generated_remediation_intake_agent_v1_seed_consumption_proof_v1",